<?xml version="1.0" encoding="UTF-8"?>
<dataroot xmlns:od="urn:schemas-microsoft-com:officedata" xmlns:xsi="http://www.w3.org/2001/XMLSchema-instance"  xsi:noNamespaceSchemaLocation="Helmet.xsd" generated="2017-08-25T14:54:43">
<Helmet>
<ID>1</ID>
<GivenID>0</GivenID>
<Level>1</Level>
<Armor>60</Armor>
<EvasionRating>0</EvasionRating>
<EnergyShield>0</EnergyShield>
<RequiredStr>1</RequiredStr>
<RequiredDex>0</RequiredDex>
<RequiredInt>0</RequiredInt>
<ItemName>헬멧1</ItemName>
</Helmet>
<Helmet>
<ID>2</ID>
<GivenID>1</GivenID>
<Level>3</Level>
<Armor>0</Armor>
<EvasionRating>60</EvasionRating>
<EnergyShield>0</EnergyShield>
<RequiredStr>2</RequiredStr>
<RequiredDex>0</RequiredDex>
<RequiredInt>0</RequiredInt>
<ItemName>헬멧2</ItemName>
</Helmet>
<Helmet>
<ID>3</ID>
<GivenID>2</GivenID>
<Level>3</Level>
<Armor>0</Armor>
<EvasionRating>0</EvasionRating>
<EnergyShield>60</EnergyShield>
<RequiredStr>3</RequiredStr>
<RequiredDex>0</RequiredDex>
<RequiredInt>0</RequiredInt>
<ItemName>헬멧3</ItemName>
</Helmet>
<Helmet>
<ID>4</ID>
<GivenID>3</GivenID>
<Level>5</Level>
<Armor>100</Armor>
<EvasionRating>0</EvasionRating>
<EnergyShield>0</EnergyShield>
<RequiredStr>0</RequiredStr>
<RequiredDex>1</RequiredDex>
<RequiredInt>0</RequiredInt>
<ItemName>헬멧4</ItemName>
</Helmet>
<Helmet>
<ID>5</ID>
<GivenID>4</GivenID>
<Level>5</Level>
<Armor>0</Armor>
<EvasionRating>100</EvasionRating>
<EnergyShield>0</EnergyShield>
<RequiredStr>0</RequiredStr>
<RequiredDex>2</RequiredDex>
<RequiredInt>0</RequiredInt>
<ItemName>헬멧5</ItemName>
</Helmet>
<Helmet>
<ID>6</ID>
<GivenID>5</GivenID>
<Level>8</Level>
<Armor>0</Armor>
<EvasionRating>150</EvasionRating>
<EnergyShield>0</EnergyShield>
<RequiredStr>0</RequiredStr>
<RequiredDex>3</RequiredDex>
<RequiredInt>0</RequiredInt>
<ItemName>헬멧6</ItemName>
</Helmet>
<Helmet>
<ID>7</ID>
<GivenID>6</GivenID>
<Level>8</Level>
<Armor>0</Armor>
<EvasionRating>0</EvasionRating>
<EnergyShield>240</EnergyShield>
<RequiredStr>0</RequiredStr>
<RequiredDex>0</RequiredDex>
<RequiredInt>1</RequiredInt>
<ItemName>헬멧7</ItemName>
</Helmet>
<Helmet>
<ID>8</ID>
<GivenID>7</GivenID>
<Level>8</Level>
<Armor>0</Armor>
<EvasionRating>0</EvasionRating>
<EnergyShield>300</EnergyShield>
<RequiredStr>0</RequiredStr>
<RequiredDex>0</RequiredDex>
<RequiredInt>2</RequiredInt>
<ItemName>헬멧8</ItemName>
</Helmet>
<Helmet>
<ID>9</ID>
<GivenID>8</GivenID>
<Level>12</Level>
<Armor>450</Armor>
<EvasionRating>0</EvasionRating>
<EnergyShield>0</EnergyShield>
<RequiredStr>0</RequiredStr>
<RequiredDex>0</RequiredDex>
<RequiredInt>3</RequiredInt>
<ItemName>헬멧9</ItemName>
</Helmet>
<Helmet>
<ID>10</ID>
<GivenID>9</GivenID>
<Level>18</Level>
<Armor>50</Armor>
<EvasionRating>50</EvasionRating>
<EnergyShield>50</EnergyShield>
<RequiredStr>4</RequiredStr>
<RequiredDex>0</RequiredDex>
<RequiredInt>0</RequiredInt>
<ItemName>헬멧10</ItemName>
</Helmet>
<Helmet>
<ID>11</ID>
<GivenID>10</GivenID>
<Level>19</Level>
<Armor>800</Armor>
<EvasionRating>0</EvasionRating>
<EnergyShield>0</EnergyShield>
<RequiredStr>5</RequiredStr>
<RequiredDex>0</RequiredDex>
<RequiredInt>0</RequiredInt>
<ItemName>헬멧11</ItemName>
</Helmet>
<Helmet>
<ID>12</ID>
<GivenID>11</GivenID>
<Level>24</Level>
<Armor>0</Armor>
<EvasionRating>800</EvasionRating>
<EnergyShield>0</EnergyShield>
<RequiredStr>6</RequiredStr>
<RequiredDex>0</RequiredDex>
<RequiredInt>0</RequiredInt>
<ItemName>헬멧12</ItemName>
</Helmet>
<Helmet>
<ID>13</ID>
<GivenID>12</GivenID>
<Level>28</Level>
<Armor>0</Armor>
<EvasionRating>0</EvasionRating>
<EnergyShield>800</EnergyShield>
<RequiredStr>0</RequiredStr>
<RequiredDex>7</RequiredDex>
<RequiredInt>0</RequiredInt>
<ItemName>헬멧123</ItemName>
</Helmet>
<Helmet>
<ID>14</ID>
<GivenID>13</GivenID>
<Level>32</Level>
<Armor>800</Armor>
<EvasionRating>200</EvasionRating>
<EnergyShield>0</EnergyShield>
<RequiredStr>0</RequiredStr>
<RequiredDex>8</RequiredDex>
<RequiredInt>0</RequiredInt>
<ItemName>헬멧15</ItemName>
</Helmet>
<Helmet>
<ID>15</ID>
<GivenID>14</GivenID>
<Level>36</Level>
<Armor>100</Armor>
<EvasionRating>800</EvasionRating>
<EnergyShield>0</EnergyShield>
<RequiredStr>0</RequiredStr>
<RequiredDex>9</RequiredDex>
<RequiredInt>0</RequiredInt>
<ItemName>헬멧19</ItemName>
</Helmet>
<Helmet>
<ID>16</ID>
<GivenID>15</GivenID>
<Level>42</Level>
<Armor>100</Armor>
<EvasionRating>500</EvasionRating>
<EnergyShield>400</EnergyShield>
<RequiredStr>0</RequiredStr>
<RequiredDex>0</RequiredDex>
<RequiredInt>9</RequiredInt>
<ItemName>헬멧20</ItemName>
</Helmet>
<Helmet>
<ID>17</ID>
<GivenID>16</GivenID>
<Level>49</Level>
<Armor>800</Armor>
<EvasionRating>0</EvasionRating>
<EnergyShield>400</EnergyShield>
<RequiredStr>0</RequiredStr>
<RequiredDex>0</RequiredDex>
<RequiredInt>8</RequiredInt>
<ItemName>헬멧23</ItemName>
</Helmet>
<Helmet>
<ID>18</ID>
<GivenID>17</GivenID>
<Level>56</Level>
<Armor>0</Armor>
<EvasionRating>1200</EvasionRating>
<EnergyShield>0</EnergyShield>
<RequiredStr>0</RequiredStr>
<RequiredDex>0</RequiredDex>
<RequiredInt>7</RequiredInt>
<ItemName>헬멧24</ItemName>
</Helmet>
<Helmet>
<ID>19</ID>
<GivenID>18</GivenID>
<Level>60</Level>
<Armor>1200</Armor>
<EvasionRating>0</EvasionRating>
<EnergyShield>0</EnergyShield>
<RequiredStr>0</RequiredStr>
<RequiredDex>10</RequiredDex>
<RequiredInt>0</RequiredInt>
<ItemName>헬멧25</ItemName>
</Helmet>
<Helmet>
<ID>20</ID>
<GivenID>19</GivenID>
<Level>62</Level>
<Armor>0</Armor>
<EvasionRating>0</EvasionRating>
<EnergyShield>1200</EnergyShield>
<RequiredStr>11</RequiredStr>
<RequiredDex>0</RequiredDex>
<RequiredInt>0</RequiredInt>
<ItemName>헬멧26</ItemName>
</Helmet>
<Helmet>
<ID>21</ID>
<GivenID>20</GivenID>
<Level>70</Level>
<Armor>1000</Armor>
<EvasionRating>1000</EvasionRating>
<EnergyShield>1000</EnergyShield>
<RequiredStr>0</RequiredStr>
<RequiredDex>0</RequiredDex>
<RequiredInt>12</RequiredInt>
<ItemName>스틸스케일부츠</ItemName>
</Helmet>
</dataroot>
